Tour,Id_phrase,phrase,lemmes,accord
53,fradhds-upn_3073W81_PV_CA_2003-05-26_TEI.s246,Mme HANEN est défavorable à une partie de la phrase figurant au 4e § de la motion « incompatible avec un management servilement calqué sur le modèle de l' entreprise privée » ;,Monsieur HANEN être défavorable à un partie de le phrase figurer à+le 4e paragraphe de le motion « incompatible avec un management servilement calquer sur le modèle de le entreprise privé » ;,D
53,fradhds-upn_3073W81_PV_CA_2003-05-26_TEI.s247,elle estime cette expression « langue de bois » .,lui estimer ce expression « langue de bois » .,D
84,fradhds-upn_3073W81_PV_CA_2003-05-26_TEI.s341,Elle juge scandaleux de revenir sur des droits étudiants tels que la compensation entre les semestres .,lui juger scandaleux de revenir sur un droit étudiant tel que le compensation entre le semestre .,D
102,fradhds-upn_3073W81_PV_CA_2003-05-26_TEI.s414,Mlle MARY votera contre ces propositions relatives aux droits d' inscription - Cultur'PX s' élève en effet contre toute augmentation des droits d' inscription .,Mlle Mary voter contre ce proposition relatif à+le droit de inscription - Cultur'PX se_expl élever en effet contre tout augmentation de+le droit de inscription .,D
114,fradhds-upn_3073W81_PV_CA_2003-05-26_TEI.s463,"Un étudiant et salarié à la BDIC lit , pour information , une motion demandant le report des examens en raison des grèves des transports , se prononçant contre toute décentralisation des personnels , demandant le respect sans les alourdir des services des personnels IATOS et enseignants , demandant le retrait des plans Ferry et Fillon , l' abrogation de la loi sur la décentralisation , et apportant son soutien aux mouvements de grève en cours .","un étudiant et salarié à le BDIC lire , pour information , un motion demander le report de+le examen en raison de+le grève de+le transport , soi prononcer contre tout décentralisation de+le personnel , demander le respect sans eux alourdir un service de+le personnel IATOS et enseignant , demander le retrait de+le plan Ferry et Fillon , le abrogation de le loi sur le décentralisation , et apporter son soutien à+le mouvement de grève en cours .",D
60,frau-upn_2010040_PV_CA_2004-10-04_TEI.s267,"M. ZEMMOUR présente les raisons pour lesquelles l' UNEF appelle à voter contre ces propositions : il s' agit d' un texte d' orientation sur les moyens , or les moyens ne sont pas définis .","Monsieur ZEMMOUR présenter le raison pour lequel le UNEF appeler à voter contre ce proposition : lui se_expl agir de un texte de orientation sur le moyen , or le moyen ne être pas définir .",D
106,frau-upn_2010040_PV_CA_2004-10-04_TEI.s476,M. LEGRAND fait part de son désaccord .,Monsieur LEGRAND faire part de son désaccord .,D
28,frau-upn_2010040-06_PV_CA_2000-03-13_TEI.s109,M. MARY juge anormal le financement complémentaire de 550 000 F au titre du gardiennage ;,Monsieur Mary juger anormal le financement complémentaire de 550 000 F à+le titre de+le gardiennage ;,D
35,frau-upn_2010040-06_PV_CA_2000-03-13_TEI.s143,"Il estime le niveau des redevances en vigueur , trop élevé ;","lui estimer le niveau de+le redevance en vigueur , trop élevé ;",D
37,frau-upn_2010040-06_PV_CA_2000-03-13_TEI.s149,il souligne son désaccord avec la formule : « il faut que quelqu'un paie » .,lui souligner son désaccord avec le formule : « il_expl falloir que quelqu'un payer » .,D
69,frau-upn_2010040-06_PV_CA_2000-03-13_TEI.s249,"Mme WOLIKOW estime très insuffisant de n' admettre à l' IUFM qu' un nombre d' étudiants représentant 1 , 5 à 2 fois le nombre de postes mis aux concours de professeur des écoles - c' est ce que prévoit le projet de réforme .","Monsieur WOLIKOW estimer très insuffisant de ne admettre à le IUFM que un nombre de étudiant représenter 1 , 5 à 2 fois le nombre de poste mettre à+le concours de professeur un école - ce être ce que prévoir le projet de réforme .",D
88,frau-upn_2010040-06_PV_CA_2000-03-13_TEI.s300,Les représentants des étudiants expriment leur désaccord avec cette proposition ;,le représentant de+le étudiant exprimer son désaccord avec ce proposition ;,D
117,weban-upn_PV_CA_2012-10-22_TEI.s319,Il se dit gêné par la nomination directe du professeur dans la motion .,lui se_expl dire gêner par le nomination direct de+le professeur dans le motion .,D
98,weban-upn_PV_CA_2011-10-17_TEI.s374,Il trouve que ce n' est pas une bonne idée pour les étudiants .,lui trouver que ce ne être pas un bon idée pour le étudiant .,D
35,fradhds-upn_3073W81_PV_CA_2003-04-28_TEI.s193,Il se dit choqué que le projet de décentralisation se préoccupe plus d' une affectation administrative que des besoins et du rôle des COP .,lui se_expl dire choquer que le projet de décentralisation se_expl préoccuper plus de un affectation administratif que un besoin et de+le rôle de+le COP .,D
62,fradhds-upn_3073W81_PV_CA_2003-04-28_TEI.s316,"Elle est de plus étonnée des montants des tarifs du CEP qui concernent surtout des formations tertiaires , comparativement à ceux de l' IUT qui ont trait essentiellement à des formations industrielles .","lui être de plus étonner de+le montant de+le tarif de+le CEP qui concerner surtout un formation tertiaire , comparativement à celui de le IUT qui avoir traire essentiellement à un formation industriel .",D
21,weban-upn_PV_CA_2018-09-10_TEI-corr.s142,Il est surpris de voir un jeune ne pas avoir de place en sociologie en L1 à Paris Nanterre .,lui être surprendre de voir un jeune ne pas avoir un place en sociologie en L1 à Paris Nanterre .,D
62,weban-upn_PV_CA_2018-09-10_TEI-corr.s407,"Mme DUBOIS se réjouit qu' une séance entière soit consacrée au budget mais il est regrettable de ne pas faire un point sur les difficultés rencontrées lors de cette rentrée , notamment l' absence de cours en ligne .","Monsieur DUBOIS se_expl réjouir que un séance entier être consacrer à+le budget mais il_expl être regrettable de ne pas faire un point sur le difficulté rencontrer lors de ce rentrée , notamment le absence de cours en ligne .",D
2,weban-upn_PV_CA_2010-03-25_TEI.s3,"« Je tiens à déclarer que j' ai été particulièrement choquée à la lecture du compte-rendu de la Commission budgétaire du 16 mars 2010 rédigé par M. ABECASSIS , Président de la commission .","« moi tenir à déclarer que moi avoir être particulièrement choquer à le lecture de+le compte-rendu de le commission budgétaire de+le 16 mars 2010 rédiger par Monsieur ABECASSIS , président de le commission .",D
17,fradhds-upn_2283W_CR_CA_1986-12-01_TEI.s82,"Il souhaite que cette grève ne pénalise pas les non-grévistes , et met en garde le Conseil d' Administration , car si on reporte les examens de janvier et février , cela veut dire que les gens salariés vont avoir des problèmes , ceux qui font des stages de préparation dans les grandes écoles en juillet aussi .","lui souhaiter que ce grève ne pénaliser pas le non-gréviste , et mettre en garde le conseil de administration , car si on reporter le examen de janvier et février , cela vouloir dire que le gens salarié aller avoir un problème , celui qui faire un stage de préparation dans le grand école en juillet aussi .",D
34,weban-upn_PV_CA_2013-01-28_TEI.s129,M. PERL juge malvenu de faire intervenir un agent administratif sur des questions d' ordre politique car cela place ce dernier en porte-à-faux .,Monsieur PERL juger malvenu de faire intervenir un agent administratif sur un question de ordre politique car cela placer ce dernier en porte-à-faux .,D
36,weban-upn_PV_CA_2013-01-28_TEI.s132,"Elle juge par ailleurs regrettable que la commission sur le règlement intérieur n' ait pas transmis plus en amont ses conclusions car les membres de cette instance , qui ne siègent pas en Conseil d' administration , auraient apprécié de pouvoir participer au présent débat .","lui juger par ailleurs regrettable que le commission sur le règlement intérieur ne avoir pas transmettre plus en amont son conclusion car le membre de ce instance , qui ne siéger pas en conseil de administration , avoir apprécier de pouvoir participer à+le présent débat .",D
67,frau-upn_2010040_PV_CA_2005-02-21_TEI.s279,M. BARRAUD se dit choqué par certaines phrases du texte discuté qui font apparaître une primauté de la Recherche sur l' Enseignement au sein de l' université :,Monsieur BARRAUD se_expl dire choquer par certain phrase de+le texte discuter qui faire apparaître un primauté de le recherche sur le enseignement à+le sein de le université :,D
77,frau-upn_2010040_PV_CA_2005-02-21_TEI.s315,"Il est en désaccord avec ce qui a été avancé par M. BARRAUD car , derrière le statut des enseignants-chercheurs , une conception particulière de l' université a toujours été défendue : il ne s' agit pas seulement d' évaluer les collègues mais d' affirmer aussi que la spécificité de l' Enseignement universitaire est d' être mis en pratique et en œuvre par les chercheurs eux-mêmes .","lui être en désaccord avec ce qui avoir être avancer par Monsieur BARRAUD car , derrière le statut de+le enseignant-chercheur , un conception particulier de le université avoir toujours être défendre : il_expl ne se_expl agir pas seulement de évaluer le collègue mais de affirmer aussi que le spécificité de le enseignement universitaire être de être mettre en pratique et en œuvre par le chercheur eux-mêmes .",D
93,frau-upn_2010040_PV_CA_2005-02-21_TEI.s371,"S' agissant de l' argument quantitatif , il estime qu' il serait illogique d' opposer en interne la logique des « L-M » et la logique du « D » .","se_expl agir de le argument quantitatif , lui estimer que il_expl être illogique de opposer en interne le logique de+le « L-M » et le logique de+le « D » .",D
12,frau-upn_2010040_PV_CA_2006-09-25_TEI.s56,"Elle votera donc contre , notamment parce que certaines répartitions sont inéquitables .","lui voter donc contre , notamment parce que certain répartition être inéquitable .",D
56,frau-upn_2010040_PV_CA_2006-09-25_TEI.s255,Dès lors M. LABICA votera contre .,dès lors Monsieur LABICA voter contre .,D
70,frau-upn_2010040_PV_CA_2006-09-25_TEI.s343,"Mme TALLINEAU estime cette mention inutile , puisqu' un rapport annuel sans bilan financier ne serait pas utile .","Monsieur TALLINEAU estimer ce mention inutile , puisque un rapport annuel sans bilan financier ne être pas utile .",D
58,weban-upn_PV_CA_2007-10-22_TEI.s201,Elle estime donc contradictoire de vouloir faire voter au plus vite des réformes d' organisation de fond de composantes centrales ( SCUIO et CEP ) .,lui estimer donc contradictoire de vouloir faire voter à+le plus vite de+le réforme de organisation de fond de composante central ( SCUIO et CEP ) .,D
89,weban-upn_PV_CA_2007-10-22_TEI.s300,Monsieur LABICA souligne qu' il est regrettable que les discussions sous-estiment de fait le travail effectué par Mme SIOUDAN et Mme GUILLARD .,Monsieur LABICA souligner que il_expl être regrettable que le discussion sous-estimer de fait le travail effectuer par Monsieur SIOUDAN et Monsieur GUILLARD .,D
157,weban-upn_PV_CA_2007-10-22_TEI.s507,"Elle trouve dommage que tout ce qui concerne les stages et l' emploi ne soit pas réunit en un même service ( documentation , offres de stage , ateliers … ) .","lui trouver dommage que tout ce qui concerner le stage et le emploi ne être pas réunir en un même service ( documentation , offre de stage , atelier ... ) .",D
159,weban-upn_PV_CA_2007-10-22_TEI.s513,Madame RAYMOND estime incohérent que les ateliers de technique de recherche d' emploi ne soient pas gérés en partie par les personnes qui gèrent les offres de stage .,Monsieur Raymond estimer incohérent que le atelier de technique de recherche de emploi ne être pas gérer en partie par le personne qui gérer le offre de stage .,D
223,weban-upn_PV_CA_2007-10-22_TEI.s729,Il trouve extraordinaire que le CA ait pu envisager de ne pas recevoir la délégation .,lui trouver extraordinaire que le CA avoir pouvoir envisager de ne pas recevoir le délégation .,D
47,fradhds-upn_2283W_CR_CA_1985-01-14_TEI.s204,M. DOMMERGUES est surpris de voir que l' informatique est concentrée en 1ère année .,Monsieur DOMMERGUES être surprendre de voir que le informatique être concentrer en 1ère année .,D
42,fradhds-upn_3073W81_PV_CA_2003-03-24_TEI.s271,M. GIBERT s' est beaucoup étonné à la réception de ce document ;,Monsieur GIBERT se_expl être beaucoup étonner à le réception de ce document ;,D
46,fradhds-upn_3073W81_PV_CA_2003-03-24_TEI.s293,Il estime cela inacceptable .,lui estimer cela inacceptable .,D
59,fradhds-upn_3073W81_PV_CA_2003-03-24_TEI.s353,Il estime également hâtif le calendrier de mise en œuvre .,lui estimer également hâtif le calendrier de mise en œuvre .,D
63,fradhds-upn_3073W81_PV_CA_2003-03-24_TEI.s386,M. DESMELIERS se dit surpris par la remarque de M. GIBERT qui estime que la motion de l' UNEF comporte un caractère dilatoire ;,Monsieur DESMELIERS se_expl dire surprendre par le remarque de Monsieur GIBERT qui estimer que le motion de le UNEF comporter un caractère dilatoire ;,D
65,fradhds-upn_3073W81_PV_CA_2003-03-24_TEI.s399,mais il souhaite une mobilisation pour faire reculer des réformes qu' il juge mauvaises .,mais lui souhaiter un mobilisation pour faire reculer un réforme que lui juger mauvais .,D
65,fradhds-upn_3073W81_PV_CA_2003-03-24_TEI.s407,Il juge cette réforme néfaste et souhaite que le CA fasse savoir qu' il s' y oppose .,lui juger ce réforme néfaste et souhaiter que le CA faire savoir que lui se_expl y opposer .,D
80,fradhds-upn_3073W81_PV_CA_2003-03-24_TEI.s470,M. PAIN souligne qu' il est gêné par le tabagisme .,Monsieur PAIN souligner que lui être gêner par le tabagisme .,D
16,frau-upn_2010040_CR_CA_1989-02-13_TEI.s71,"Au nom de l' UNEF-ID , Mademoiselle PARADIS se déclare contre un projet d' implantation à Cergy-Pontoise sauf garanties sur l' avenir , ( création d' un 2e cycle ) .","à+le nom de le UNEF-ID , Mademoiselle PARADIS soi déclarer contre un projet de implantation à Cergy-Pontoise sauf garantie sur le avenir , ( création de un 2e cycle ) .",D
20,frau-upn_2010040_CR_CA_1989-02-13_TEI.s80,"Mademoiselle PARADIS précise qu' une des raisons de son désaccord avec l' implantation de L.E.A , à Cergy est justement la façon dont fonctionne le L.E.A. de Paris X , qui commence par une pré-inscription , ( à savoir le test ) ;","Mademoiselle PARADIS préciser que un de+le raison de son désaccord avec le implantation de L.E.A , à Cergy être justement le façon dont fonctionner le L.E.A. de Paris X , qui commencer par un pré-inscription , ( à savoir le test ) ;",D
23,frau-upn_2010040_CR_CA_1989-02-13_TEI.s97,Il s' agit de bien dire que nous sommes hostiles ( et cela a déjà été dit ) au principe d' un DEUG délocalisé .,il_expl se_expl agir de bien dire que nous être hostile ( et cela avoir déjà être dire ) à+le principe de un DEUG délocaliser .,D
45,frau-upn_2010040_CR_CA_1989-02-13_TEI.s183,Monsieur DENEUX estime regrettable de devoir soumettre un tel texte au Conseil d' Administration mais il faut constater que le déroulement des activités pédagogiques et du contrôle des connaissances est actuellement perturbé et risque de l' être encore davantage par d' autres activités .,Monsieur DENEUX estimer regrettable de devoir soumettre un tel texte à+le conseil de administration mais il_expl falloir constater que le déroulement de+le activité pédagogique et de+le contrôle de+le connaissance être actuellement perturber et risquer de lui être encore davantage par un autre activité .,D
42,frau-upn_2010040-05_CR_CA_1999-03-29_TEI.s143,"M. MARY fait part de son désaccord sur la durée ramenée à une semaine des vacances de printemps , une partie des étudiants exerçant une activité salariée à cette période .","Monsieur Mary faire part de son désaccord sur le durée ramener à un semaine de+le vacance de printemps , un partie de+le étudiant exercer un activité salarié à ce période .",D
71,frau-upn_2010040-05_CR_CA_1999-03-29_TEI.s218,"M. TRABELSI fait part de son désaccord sur cette disposition dans la mesure où il est selon lui , dans les missions de l' université d' assurer gratuitement la nécessaire remise à niveau en français des étudiants étrangers .","Monsieur TRABELSI faire part de son désaccord sur ce disposition dans le mesure où lui être selon lui , dans le mission de le université de assurer gratuitement le nécessaire remise à niveau en français un étudiant étranger .",D
89,frau-upn_2010040-05_CR_CA_1999-03-29_TEI.s254,"M. TRABELSI exprime son désaccord concernant la contribution de l' université à l' organisation de ce Gala : prêt de la CSE , prêt de locaux , mise à contribution des appariteurs .","Monsieur TRABELSI exprimer son désaccord concernant le contribution de le université à le organisation de ce Gala : prêt de le CSE , prêt de local , mise à contribution de+le appariteur .",D
47,frau-upn_2010040_CR_CA_1990-04-02_TEI.s145,Monsieur ZIGHERA est très sceptique sur cette proposition en raison de l' absence quasi permanente de ces personnalités extérieures aux séances du conseil .,Monsieur ZIGHERA être très sceptique sur ce proposition en raison de le absence quasi permanent de ce personnalité extérieur à+le séance de+le conseil .,D
3,frau-upn_2010040_PV_CA_2006-03-20_TEI.s3,"Mlle MAHIEDDINE prend la parole pour signaler que des incidents viennent de survenir entre des étudiants et des membres du service de sécurité à l' entrée du bâtiment B. Elle déclare que certains ont été molestés , ce qu' elle estime inadmissible .","Mlle MAHIEDDINE prendre le parole pour signaler que un incident venir de survenir entre un étudiant et un membre de+le service de sécurité à le entrée de+le bâtiment B. lui déclarer que certain avoir être molester , ce que lui estimer inadmissible .",D
34,frau-upn_2010040_PV_CA_2004-12-06_TEI.s151,Mme LE PELLEC estime qu' il n' est pas opportun d' en faire un règle générale .,Monsieur le PELLEC estimer que il_expl ne être pas opportun de en faire un règle général .,D
75,weban-upn_PV_CA_2018-10-15_TEI.s401,Il est regrettable que les personnels de Phillia ne puissent être intégrés dans le cadre de la mention 4 ;,il_expl être regrettable que le personnel de Phillia ne pouvoir être intégrer dans le cadre de le mention 4 ;,D
96,weban-upn_PV_CA_2018-10-15_TEI.s504,"Par ailleurs , M. PIERRE se dit surpris de l' information donnée par Mme EFFOSSE sur le contrat doctorant handicap et souhaite avoir plus d' informations à ce sujet .","par ailleurs , Monsieur Pierre se_expl dire surprendre de le information donner par Monsieur EFFOSSE sur le contrat doctorant handicap et souhaiter avoir plus de information à ce sujet .",D
4,frau-upn_2010040-04_CR_CA_1993-03-08_TEI.s26,"Si les premiers nouveaux départements d' IUT dans l' Académie de Versailles ne sont pas financés , il est très inquiet du futur fonctionnement de tous les nouveaux départements d' IUT dans la mesure où il est est prévu d' ajouter 52 départements aux 19 existants .","si le premier nouveau département de IUT dans le académie de Versailles ne être pas financer , lui être très inquiet de+le futur fonctionnement de tout le nouveau département de IUT dans le mesure où lui être être prévoir de ajouter 52 département à+le 19 existant .",D
14,frau-upn_2010040-04_CR_CA_1993-03-08_TEI.s81,M. TEILLET trouve inacceptable que les moyens indispensables en personnels IATOS ne soient pas pris en compte et demande que le Conseil d' Administration vote une motion .,Monsieur Teillet trouver inacceptable que le moyen indispensable en personnel IATOS ne être pas prendre en compte et demander que le conseil de administration voter un motion .,D
31,frau-upn_2010040-04_CR_CA_1993-03-08_TEI.s118,""" Le Conseil d' Administration , tout en étant conscient de l' effort financier représenté par le contrat proposé à l' Université , trouve inacceptable que les moyens indispensables en personnels , dont cet effort devrait être assorti , ne soient même pas pris en compte .",""" le conseil de administration , tout en être conscient de le effort financier représenter par le contrat proposer à le université , trouver inacceptable que le moyen indispensable en personnel , dont ce effort devoir être assortir , ne être même pas prendre en compte .",D
105,weban-upn_PV_CA_2013-03-25_TEI.s375,"M. BRETTE se déclare étonné par le nombre élevé de dispositions , nombre qui ne facilite pas la compréhension des modalités générales de contrôle des connaissances par les étudiants .","Monsieur Brette se_expl déclarer étonner par le nombre élevé de disposition , nombre qui ne faciliter pas le compréhension de+le modalité général de contrôle un connaissance par le étudiant .",D
104,frau-upn_2010040_PV_CA_2006-10-16_TEI.s238,Mme DUPUIS semble choquée que la taxe d' apprentissage soit utilisée par le master de M. ZADJENWEBER pour rémunérer quelqu'un et affirme qu' il serait plus opportun d' acheter du matériel pour les étudiants .,Monsieur DUPUIS sembler choquer que le taxe de apprentissage être utiliser par le master de Monsieur ZADJENWEBER pour rémunérer quelqu'un et affirmer que il_expl être plus opportun de acheter du matériel pour le étudiant .,D
2,weban-upn_PV_CA_2017-03-29_TEI.s8,Il est regrettable que les personnes qui ne se satisfont pas de ce mode de fonctionnement ne sollicitent pas d' être reçues .,il_expl être regrettable que le personne qui ne se_expl satisfaire pas de ce mode de fonctionnement ne solliciter pas de être recevoir .,D
24,weban-upn_PV_CA_2017-03-29_TEI.s178,"» Ayant été élu sur ce mandat , le syndicat se prononcera contre la sélection en master .","» avoir être élire sur ce mandat , le syndicat soi prononcer contre le sélection en master .",D
26,weban-upn_PV_CA_2017-03-29_TEI.s181,M. BRECHET se dit surpris que les universitaires qui ont veillé à transmettre les fiches de renseignements des UFR et à mettre en œuvre ce texte se prononcent à présent contre .,Monsieur BRECHET se_expl dire surprendre que le universitaire qui avoir veiller à transmettre le fiche de renseignement de+le UFR et à mettre en œuvre ce texte se_expl prononcer à présent contre .,D
75,weban-upn_PV_CA_2017-03-29_TEI.s626,Mme ROBERT se prononce contre le principe du service civique et contre le projet .,Monsieur Robert soi prononcer contre le principe de+le service civique et contre le projet .,D
6,weban-upn_PV_CA_2008-07-08_TEI.s44,Il est surpris de l' augmentation des dépenses relatives au contrat de nettoyage .,lui être surprendre de le augmentation de+le dépense relatif à+le contrat de nettoyage .,D
46,frau-upn_2010040-05_CR_CA_1999-07-05_TEI.s112,Elle votera contre ces tarifs .,lui voter contre ce tarif .,D
47,frau-upn_2010040-05_CR_CA_1999-07-05_TEI.s113,"M. MAUREAU considère les tarifs proposés relativement élevés , notamment pour les passagers utilisant la piscine : ticket à 28 F","Monsieur MAUREAU considérer le tarif proposer relativement élevé , notamment pour le passager utiliser le piscine : ticket à 28 F",D
48,frau-upn_2010040-05_CR_CA_1999-07-05_TEI.s114,M. MARY estime qu' il est contradictoire d' affirmer que le sport est à la portée de tous ( cf statuts du SUAPS ) et d' en faire payer l' accès .,Monsieur Mary estimer que il_expl être contradictoire de affirmer que le sport être à le portée de tout ( cf statut de+le SUAPS ) et de en faire payer le accès .,D
48,frau-upn_2010040-05_CR_CA_1999-07-05_TEI.s115,en instituant des tarifs qu' il considère élevés .,en instituer un tarif que lui considérer élevé .,D
49,frau-upn_2010040-05_CR_CA_1999-07-05_TEI.s116,"Mme DAVID ne trouve pas logique que les étudiants de Paris X paient le même tarif que les personnels , il serait préférable selon elle , que la carte annuelle individuelle soit de 100 f pour les étudiants ;","Monsieur David ne trouver pas logique que le étudiant de Paris X payer le même tarif que le personnel , lui être préférable selon lui , que le carte annuel individuel être de 100 f pour le étudiant ;",D
50,frau-upn_2010040-05_CR_CA_1999-07-05_TEI.s119,Elle estime les tarifs proposés élevés ;,lui estimer le tarif proposer élever ;,D
65,frau-upn_2010040-05_CR_CA_1999-07-05_TEI.s159,Mlle DAVID et M. QUIRANTE font part de leur accord quant à l' exonération des droits pour les étudiants boursiers et quant à la nécessité de l' affectation effective des recettes des droits à l' IEJ mais voteront contre l' augmentation des droits ;,Mlle David et Monsieur QUIRANTE faire part de son accord quant à le exonération de+le droit pour le étudiant boursier et quant à le nécessité de le affectation effectif de+le recette de+le droit à le IEJ mais voter contre le augmentation de+le droit ;,D
74,frau-upn_2010040-05_CR_CA_1999-07-05_TEI.s190,"Mme RIOUX et M. QUIRANTE estiment anormal que les règles de contrôle différent d' une UFR à l' autre , et considèrent qu' une règle uniforme devrait s' appliquer .","Monsieur Rioux et Monsieur QUIRANTE estimer anormal que le règle de contrôle différent de un UFR à le autre , et considérer que un règle uniforme devoir se_expl appliquer .",D
99,frau-upn_2010040-05_CR_CA_1999-07-05_TEI.s256,"Mme KRIEGEL fait part de son accord quant à une évaluation des enseignements au travers des jurys , telle que l' a présentée M. DUBOIS mais elle se déclare sceptique sur la pertinence de l' évaluation du contenu des cours .","Monsieur KRIEGEL faire part de son accord quant à un évaluation de+le enseignement à+le travers de+le jury , tel que lui avoir présenter Monsieur DUBOIS mais lui se_expl déclarer sceptique sur le pertinence de le évaluation de+le contenu de+le cours .",D
