Tour,Id_phrase,phrase,lemmes,accord
14,frau-upn_2010040_PV_CA_2005-09-19_TEI.s36,Christiane GUILLARD devra mener une réflexion sur l' enseignement et le futur bâtiment des Langues .,Christiane GUILLARD devoir mener un réflexion sur le enseignement et le futur bâtiment de+le Langues .,A
15,frau-upn_2010040_PV_CA_2005-09-19_TEI.s37,Mlle MARY demande que pour le prochain CA soient communiqués les chiffres exacts des inscriptions 2005 .,Mlle Mary demander que pour le prochain CA être communiquer le chiffre exact de+le inscription 2005 .,A
15,frau-upn_2010040_PV_CA_2005-09-19_TEI.s38,Elle estime que les associations étudiantes n' ont pas été sollicitées dans la préparation du volet Vie de l' Etudiant du contrat quadriennal .,lui estimer que le association étudiant ne avoir pas être solliciter dans le préparation de+le volet vie de le etudiant de+le contrat quadriennal .,A
15,frau-upn_2010040_PV_CA_2005-09-19_TEI.s39,Elle souhaite que les sessions d' examens à venir soient conformes au calendrier voté .,lui souhaiter que le session de examen à venir être conforme à+le calendrier voter .,A
16,frau-upn_2010040_PV_CA_2005-09-19_TEI.s40,M. PRIOU rappelle que tous les acteurs de la communauté universitaire ont été consultés dans l' élaboration de ce contrat quadriennal .,Monsieur PRIOU rappeler que tout le acteur de le communauté universitaire avoir être consulter dans le élaboration de ce contrat quadriennal .,A
17,frau-upn_2010040_PV_CA_2005-09-19_TEI.s41,"Mlle MARY estime que malgré cela , certaines associations ont échappé à la concertation .","Mlle Mary estimer que malgré cela , certain association avoir échapper à le concertation .",A
18,frau-upn_2010040_PV_CA_2005-09-19_TEI.s42,"M. AUDEOUD , en réponse à M. BRUNET , indique que M.RAMOUNI a été présenté comme le responsable associatif de « ZIVA » .","Monsieur AUDEOUD , en réponse à Monsieur Brunet , indiquer que M.RAMOUNI avoir être présenter comme le responsable associatif de « Ziva » .",A
19,frau-upn_2010040_PV_CA_2005-09-19_TEI.s43,"M. LABICA demande des précisions sur la mise en œuvre d' une réflexion sur la place des langues à Nanterre , sur le futur bâtiment des Langues et sur la perspective de fusion de deux UFR : Langues et EAA .","Monsieur LABICA demander un précision sur le mise en œuvre de un réflexion sur le place de+le langue à Nanterre , sur le futur bâtiment de+le Langues et sur le perspective de fusion de deux UFR : Langues et EAA .",A
20,frau-upn_2010040_PV_CA_2005-09-19_TEI.s44,Mme GUILLARD remarque qu' un débat va avoir lieu en conseil d' UFR en novembre .,Monsieur GUILLARD remarquer que un débat aller avoir lieu en conseil de UFR en novembre .,A
21,frau-upn_2010040_PV_CA_2005-09-19_TEI.s45,M. AUDEOUD explique que la livraison du bâtiment des Langues se fera en janvier 2008 .,Monsieur AUDEOUD expliquer que le livraison de+le bâtiment de+le Langues se_expl faire en janvier 2008 .,A
21,frau-upn_2010040_PV_CA_2005-09-19_TEI.s46,"Une fusion des deux UFR , apparaît souhaitable suite à une négociation avec le Ministère sur les Langues et le Programme Pluri Formation .","un fusion de+le deux UFR , apparaître souhaitable suite à un négociation avec le ministère sur le Langues et le programme Pluri formation .",A
21,frau-upn_2010040_PV_CA_2005-09-19_TEI.s47,Cela donnera un plus grand poids aux Langues dans l' université .,cela donner un plus grand poids à+le Langues dans le université .,A
22,frau-upn_2010040_PV_CA_2005-09-19_TEI.s48,Mme GUILLARD précise que le projet de création du Centre de ressources langues ( sous l' autorité de l' UFR de Langues ) dans le cadre du contrat quadriennal fera l' objet en janvier 2006 de l' attribution d' un poste IATOS en la personne de Mme SIOUDAN .,Monsieur GUILLARD préciser que le projet de création de+le centre de ressource langue ( sous le autorité de le UFR de Langues ) dans le cadre de+le contrat quadriennal faire le objet en janvier 2006 de le attribution de un poste IATOS en le personne de Monsieur SIOUDAN .,A
23,frau-upn_2010040_PV_CA_2005-09-19_TEI.s49,Mlle MARY demande si on sera en mesure de présenter les résultats des tests de langues des primo entrants : tous n' ont pas passé ou trouvé le lieu de ces tests .,Mlle Mary demander si on être en mesure de présenter le résultat de+le test de langue de+le primo entrant : tout ne avoir pas passer ou trouver le lieu de ce test .,A
24,frau-upn_2010040_PV_CA_2005-09-19_TEI.s50,Mme GUILLARD précise que ces données seront connues prochainement et que la notation par contrôle continu sera adaptée aux groupes de niveau .,Monsieur GUILLARD préciser que ce donnée être connaître prochainement et que le notation par contrôle continu être adapter à+le groupe de niveau .,A
25,frau-upn_2010040_PV_CA_2005-09-19_TEI.s51,"M. LEYSSALLE , sur le projet Seine Arche demande s' il est prévu un volet logement et quelle est la position de l' université sur ce dossier .","Monsieur LEYSSALLE , sur le projet Seine Arche demander si lui être prévoir un volet logement et quel être le position de le université sur ce dossier .",A
26,frau-upn_2010040_PV_CA_2005-09-19_TEI.s52,M. AUDEOUD explique qu' il manque 5000 logements sur le secteur de l' université .,Monsieur AUDEOUD expliquer que lui manquer 5000 logement sur le secteur de le université .,A
26,frau-upn_2010040_PV_CA_2005-09-19_TEI.s53,Notre priorité est de trouver une entente territoriale avec l' EPASA .,son priorité être de trouver un entente territorial avec le EPASA .,A
27,frau-upn_2010040_PV_CA_2005-09-19_TEI.s54,"M. BRUNET répond que le projet Seine Arche va s' échelonner sur 25 ans , il y aura un volet « logement étudiant » .","Monsieur Brunet répondre que le projet Seine Arche aller se_expl échelonner sur 25 an , il_expl y avoir un volet « logement étudiant » .",A
27,frau-upn_2010040_PV_CA_2005-09-19_TEI.s55,La mairie est en train de créer ce dossier .,le mairie être en train de créer ce dossier .,A
27,frau-upn_2010040_PV_CA_2005-09-19_TEI.s56,Il invite l' ensemble des partenaires à faire ressortir leurs besoins .,lui inviter le ensemble de+le partenaire à faire ressortir son besoin .,A
27,frau-upn_2010040_PV_CA_2005-09-19_TEI.s57,Le cofinancement ne pourra se faire qu' avec une participation de l' Etat .,le cofinancement ne pouvoir se_expl faire que avec un participation de le état .,A
28,frau-upn_2010040_PV_CA_2005-09-19_TEI.s58,M. AUDEOUD souligne que le retard en matière de logements étudiants est de 20 ans .,Monsieur AUDEOUD souligner que le retard en matière de logement étudiant être de 20 an .,A
29,frau-upn_2010040_PV_CA_2005-09-19_TEI.s59,"M. LEYSSALLE , considère que sur ce projet Seine Arche , toutes les parties auraient intérêt à réaliser des constructions respectant les normes environnementales .","Monsieur LEYSSALLE , considérer que sur ce projet Seine Arche , tout le partie avoir intérêt à réaliser un construction respecter le norme environnemental .",A
30,frau-upn_2010040_PV_CA_2005-09-19_TEI.s60,M. LABICA demande un éclaircissement sur le doublement de l' aide allouée par le Conseil général à l' université .,Monsieur LABICA demander un éclaircissement sur le doublement de le aide allouer par le conseil général à le université .,A
31,frau-upn_2010040_PV_CA_2005-09-19_TEI.s61,M. AUDEOUD explique que ce doublement a eu lieu en contrepartie d' une contractualisation .,Monsieur AUDEOUD expliquer que ce doublement avoir avoir lieu en contrepartie de un contractualisation .,A
32,frau-upn_2010040_PV_CA_2005-09-19_TEI.s62,"Mme LE PELLEC , ajoute qu' il s' agit de projets ciblés sur quatre ans , sur des opérations évaluées avec des indicateurs .","Monsieur le PELLEC , ajouter que il_expl se_expl agir de projet cibler sur quatre an , sur un opération évaluer avec un indicateur .",A
32,frau-upn_2010040_PV_CA_2005-09-19_TEI.s63,Les axes sont les suivants :,le axe être le suivant :,A
32,frau-upn_2010040_PV_CA_2005-09-19_TEI.s64,"l' excellence des pôles scientifiques en rapport avec des pôles de compétitivité concernant l' aéronautique , l' intelligence économique et le multimédia , et les stages doctorants en entreprise , la valorisation de la recherche","le excellence de+le pôle scientifique en rapport avec un pôle de compétitivité concernant le aéronautique , le intelligence économique et le multimédia , et le stage doctorant en entreprise , le valorisation de le recherche",A
32,frau-upn_2010040_PV_CA_2005-09-19_TEI.s65,"la lutte contre l' échec pour les étudiants de première année ,","le lutte contre le échec pour le étudiant de premier année ,",A
32,frau-upn_2010040_PV_CA_2005-09-19_TEI.s66,l' accessibilité des handicapés,le accessibilité de+le handicapé,A
32,frau-upn_2010040_PV_CA_2005-09-19_TEI.s67,les adultes en reprise d' études,le adulte en reprise de étude,A
32,frau-upn_2010040_PV_CA_2005-09-19_TEI.s68,l' amélioration des conditions de travail et d' études à l' université,le amélioration de+le condition de travail et de étude à le université,A
32,frau-upn_2010040_PV_CA_2005-09-19_TEI.s69,l' amélioration des salles d' informatique,le amélioration de+le salle de informatique,A
33,frau-upn_2010040_PV_CA_2005-09-19_TEI.s70,M. LABICA demande si les propos de Mme LE PELLEC s' inscrivent dans le cadre de la LOLF .,Monsieur LABICA demander si le propos de Monsieur le PELLEC se_expl inscrire dans le cadre de le LOLF .,A
34,frau-upn_2010040_PV_CA_2005-09-19_TEI.s71,"Mme LE PELLEC répond que dans l' ensemble des relations de partenariat avec le Conseil Général , nous devrons rendre des comptes .","Monsieur le PELLEC répondre que dans le ensemble de+le relation de partenariat avec le conseil général , nous devoir rendre un compte .",A
35,frau-upn_2010040_PV_CA_2005-09-19_TEI.s72,"M. CHOISEL précise que la subvention annuelle du Conseil Général à l' université est de 900 000 euros , et informe le conseil que toutes les demandes d' aide du Conseil Général aux colloques doivent passer et être visées par la présidence de l' université .","Monsieur Choisel préciser que le subvention annuel de+le conseil général à le université être de 900 000 euro , et informer le conseil que tout le demande de aide de+le conseil général à+le colloque devoir passer et être viser par le présidence de le université .",A
36,frau-upn_2010040_PV_CA_2005-09-19_TEI.s73,M. RODRIGUEZ remarque que l'on touche ici au financement de l' université et que se pose la question de son indépendance .,Monsieur RODRIGUEZ remarquer que on toucher ici à+le financement de le université et que se_expl poser le question de son indépendance .,A
36,frau-upn_2010040_PV_CA_2005-09-19_TEI.s74,"Les crédits étatiques devenant rares , le pilotage de l' université risque de se faire par une entité extérieure , en l' espèce le Conseil général .","le crédit étatique devenir rare , le pilotage de le université risquer de se_expl faire par un entité extérieur , en le espèce le conseil général .",A
36,frau-upn_2010040_PV_CA_2005-09-19_TEI.s75,"Il dit avoir eu connaissance que parmi les formations souhaitées par le Conseil Général , figure , « l' intelligence économique » , qui est une expression édulcorée de la guerre économique .","lui dire avoir avoir connaissance que parmi le formation souhaiter par le conseil général , figurer , « le intelligence économique » , qui être un expression édulcorer de le guerre économique .",A
36,frau-upn_2010040_PV_CA_2005-09-19_TEI.s76,Il souligne que l' université devra garder la maîtrise des priorités de l' utilisation des aides financières du Conseil Général et de leur ventilation .,lui souligner que le université devoir garder le maîtrise de+le priorité de le utilisation de+le aide financier de+le conseil général et de son ventilation .,A
37,frau-upn_2010040_PV_CA_2005-09-19_TEI.s77,"Mme LE PELLEC , rappelle que la convention avec le Conseil Général sera discutée devant le Conseil d' Administration .","Monsieur le PELLEC , rappeler que le convention avec le conseil général être discuter devant le conseil de administration .",A
38,frau-upn_2010040_PV_CA_2005-09-19_TEI.s78,"Mlle MARY , demande si il existe un plan d' occupation de la Maison de l' étudiant .","Mlle Mary , demander si il_expl exister un plan de occupation de le maison de le étudiant .",A
38,frau-upn_2010040_PV_CA_2005-09-19_TEI.s79,Elle suggère que la crèche soit installée dans la future maison de l' étudiant .,lui suggérer que le crèche être installer dans le futur maison de le étudiant .,A
39,frau-upn_2010040_PV_CA_2005-09-19_TEI.s80,M. AUDEOUD répond qu' on ne peut parler de l' occupation d' un bâtiment qui n' existe pas encore .,Monsieur AUDEOUD répondre que on ne pouvoir parler de le occupation de un bâtiment qui ne exister pas encore .,A
40,frau-upn_2010040_PV_CA_2005-09-19_TEI.s81,M. LEYSSALLE demande une réflexion sur l' augmentation considérable des salles informatiques au bâtiment G.,Monsieur LEYSSALLE demander un réflexion sur le augmentation considérable de+le salle informatique à+le bâtiment G.,A
41,frau-upn_2010040_PV_CA_2005-09-19_TEI.s82,M. KREUTZER précise que les colloques non agrées par l' université ne peuvent être pris en considération par le Conseil général .,Monsieur KREUTZER préciser que le colloque non agréer par le université ne pouvoir être prendre en considération par le conseil général .,A
42,frau-upn_2010040_PV_CA_2005-09-19_TEI.s84,Mme CELESTE précise que le dossier d' expertise a été approuvé par le CA en septembre 2001 .,Monsieur Celeste préciser que le dossier de expertise avoir être approuver par le CA en septembre 2001 .,A
42,frau-upn_2010040_PV_CA_2005-09-19_TEI.s85,"Elle rappelle que le projet a vu le jour en 1992 dans le schéma université 2000 , et que les départements retenus avaient été : Génie des Télécommunications et Réseaux ;","lui rappeler que le projet avoir voir le jour en 1992 dans le schéma université 2000 , et que le département retenir avoir être : génie de+le télécommunication et réseau ;",A
42,frau-upn_2010040_PV_CA_2005-09-19_TEI.s86,Science et Génie des Matériaux ; et Hygiène Sécurité et Environnement .,science et génie de+le matériau ; et hygiène sécurité et environnement .,A
42,frau-upn_2010040_PV_CA_2005-09-19_TEI.s87,"En 2001 , il y a eu un agrément d' expertise par le Ministère .","en 2001 , il_expl y avoir avoir un agrément de expertise par le ministère .",A
42,frau-upn_2010040_PV_CA_2005-09-19_TEI.s88,Le projet a ressurgi en 2004 : le recteur demande alors une actualisation en proposant deux autres départements : Gestion Administrative et Commerciale ;,le projet avoir ressurgir en 2004 : le recteur demander alors un actualisation en proposer deux autre département : gestion administratif et commercial ;,A
42,frau-upn_2010040_PV_CA_2005-09-19_TEI.s89,et Carrières sociales ( éducation spécialisée ) et propose la création d' un Centre régional de Français pour étrangers travailleurs ou étudiants ( SURFE ) .,et carrière social ( éducation spécialisé ) et proposer le création de un centre régional de français pour étranger travailleur ou étudiant ( SURFE ) .,A
42,frau-upn_2010040_PV_CA_2005-09-19_TEI.s90,Cet IUT se situerait dans le parc technologique de Gennevilliers .,ce IUT se_expl situer dans le parc technologique de Gennevilliers .,A
42,frau-upn_2010040_PV_CA_2005-09-19_TEI.s91,"Il offrira des formations initiales , des formations par apprentissage et des formations continues .","lui offrir un formation initial , un formation par apprentissage et un formation continu .",A
42,frau-upn_2010040_PV_CA_2005-09-19_TEI.s92,Le permis de construire a été déposé en juillet 2005 et l' ouverture est prévue en septembre 2008 .,le permis de construire avoir être déposer en juillet 2005 et le ouverture être prévoir en septembre 2008 .,A
43,frau-upn_2010040_PV_CA_2005-09-19_TEI.s93,"Mlle ROBERT D' ESHOUGUES demande si le seul accès est internet , concernant l' apprentissage du français en ligne tutoré pour étudiants étrangers .","Mlle Robert de ESHOUGUES demander si le seul accès être internet , concernant le apprentissage de+le français en ligne tutorer pour étudiant étranger .",A
44,frau-upn_2010040_PV_CA_2005-09-19_TEI.s94,"Mme GUILLARD , répond qu' il y a la possibilité d' envoyer aux étudiants des cassettes audio .","Monsieur GUILLARD , répondre que il_expl y avoir le possibilité de envoyer à+le étudiant de+le cassette audio .",A
45,frau-upn_2010040_PV_CA_2005-09-19_TEI.s95,"M. LEYSSALLE remarque que les migrants sont les principaux bailleurs de fonds du développement de leur pays , donc l' offre pédagogique de formation doit constituer un effort vers ces populations .","Monsieur LEYSSALLE remarquer que le migrant être le principal bailleur de fonds de+le développement de son pays , donc le offre pédagogique de formation devoir constituer un effort vers ce population .",A
45,frau-upn_2010040_PV_CA_2005-09-19_TEI.s96,Il demande si le cahier des charges du bâtiment IUT de Gennevilliers inclura des normes environnementales .,lui demander si le cahier de+le charge de+le bâtiment IUT de Gennevilliers inclure un norme environnemental .,A
46,frau-upn_2010040_PV_CA_2005-09-19_TEI.s97,M. PRIOU répond que tous les nouveaux bâtiments prennent en compte les normes environnementales .,Monsieur PRIOU répondre que tout le nouveau bâtiment prendre en compte le norme environnemental .,A
47,frau-upn_2010040_PV_CA_2005-09-19_TEI.s98,"M. BRUNET précise que le projet d' IUT était dans le plan Université 2000 et que la livraison dépendra des délais administratifs , et des accords ministériels .","Monsieur Brunet préciser que le projet de IUT être dans le plan université 2000 et que le livraison dépendre un délai administratif , et un accord ministériel .",A
48,frau-upn_2010040_PV_CA_2005-09-19_TEI.s99,Mme CELESTE déclare qu' il faut faire le maximum pour que des délais courts soient tenus .,Monsieur Celeste déclarer que il_expl falloir faire le maximum pour que un délai court être tenir .,A
49,frau-upn_2010040_PV_CA_2005-09-19_TEI.s100,Mme HANEN demande s' il est prévu un accueil des étudiants de cet IUT de manière spécifique .,Monsieur HANEN demander si lui être prévoir un accueil de+le étudiant de ce IUT de manière spécifique .,A
50,frau-upn_2010040_PV_CA_2005-09-19_TEI.s101,M.PRIOU rappelle que le programme des modules des IUT vient d' être modifié et que l' IUT de Gennevilliers utilisera ce programme .,M.PRIOU rappeler que le programme de+le module de+le IUT venir de être modifier et que le IUT de Gennevilliers utiliser ce programme .,A
51,frau-upn_2010040_PV_CA_2005-09-19_TEI.s102,M. LABICA demande comment interagit le test en ligne avec le test existant ( TCF ) .,Monsieur LABICA demander comment interagir le test en ligne avec le test existant ( TCF ) .,A
52,frau-upn_2010040_PV_CA_2005-09-19_TEI.s103,"Mme CELESTE répond qu' en fonction des résultats du test en ligne , il y aura pour les étudiants une possibilité d' avoir une formation adaptée à leurs besoins propres .","Monsieur Celeste répondre que en fonction de+le résultat de+le test en ligne , il_expl y avoir pour le étudiant un possibilité de avoir un formation adapté à son besoin propre .",A
53,frau-upn_2010040_PV_CA_2005-09-19_TEI.s104,M. LAKS considère qu' il y a un problème de définition du contenu régional du SURFE .,Monsieur LAKS considérer que il_expl y avoir un problème de définition de+le contenu régional de+le SURFE .,A
53,frau-upn_2010040_PV_CA_2005-09-19_TEI.s105,Il demande une réflexion sur la convergence avec le projet inter universités de PARIS III .,lui demander un réflexion sur le convergence avec le projet inter université de Paris III .,A
54,frau-upn_2010040_PV_CA_2005-09-19_TEI.s106,M. AUDEOUD déclare que cette opportunité existe mais que le projet est dans l' impasse à Paris III .,Monsieur AUDEOUD déclarer que ce opportunité exister mais que le projet être dans le impasse à Paris III .,A
55,frau-upn_2010040_PV_CA_2005-09-19_TEI.s107,Mme CELESTE invite les membres du Conseil d' Administration à procéder au vote .,Monsieur Celeste inviter le membre de+le conseil de administration à procéder à+le vote .,A
56,frau-upn_2010040_PV_CA_2005-09-19_TEI.s108,Le Conseil d' administration adopte à la majorité des membres présents ou représentés le modificatif au dossier d' expertise relatif au projet de construction de l' IUT de Gennevilliers .,le conseil de administration adopter à le majorité de+le membre présent ou représenter le modificatif à+le dossier de expertise relatif à+le projet de construction de le IUT de Gennevilliers .,A
56,frau-upn_2010040_PV_CA_2005-09-19_TEI.s109,Pour : 31 ;,pour : 31 ;,A
56,frau-upn_2010040_PV_CA_2005-09-19_TEI.s110,Abstentions : 2,abstention : 2,A
57,frau-upn_2010040_PV_CA_2005-09-19_TEI.s113,"M. GAY déclare que deux logements sont à attribuer dans l' immeuble de la Bibliothèque l' un au titre de la BU et l' autre au titre de la BDIC à des personnels de sécurité , pour nécessité absolue de service , il s' agit de personnels du service des Moyens généraux ayant candidaté .","Monsieur Gay déclarer que deux logement être à attribuer dans le immeuble de le bibliothèque le un à+le titre de le Bu et le autre à+le titre de le BDIC à un personnel de sécurité , pour nécessité absolu de service , il_expl se_expl agir de personnel de+le service de+le moyen général avoir candidater .",A
58,frau-upn_2010040_PV_CA_2005-09-19_TEI.s114,Mme CELESTE invite les membres du Conseil d' Administration à procéder au vote .,Monsieur Celeste inviter le membre de+le conseil de administration à procéder à+le vote .,A
59,frau-upn_2010040_PV_CA_2005-09-19_TEI.s115,Le Conseil d' administration adopte à l' unanimité des membres présents les propositions d' attributions de concessions de logement ( cf. annexe 2 ) .,le conseil de administration adopter à le unanimité de+le membre présent le proposition de attribution de concession de logement ( cf annexe 2 ) .,A
59,frau-upn_2010040_PV_CA_2005-09-19_TEI.s116,Pour : 33,pour : 33,A
60,frau-upn_2010040_PV_CA_2005-09-19_TEI.s118,M. GAY explique qu' il s' agit de voter la liste des fonctions qui ouvrent droit à une NBI pour 2005-2006 .,Monsieur Gay expliquer que il_expl se_expl agir de voter le liste de+le fonction qui ouvrir droit à un NBI pour 2005-2006 .,A
60,frau-upn_2010040_PV_CA_2005-09-19_TEI.s119,Cette liste est la reconduction de la répartition existante depuis plusieurs aimées avec toutefois quelques modifications .,ce liste être le reconduction de le répartition existant depuis plusieurs aimé avec toutefois quelque modification .,A
60,frau-upn_2010040_PV_CA_2005-09-19_TEI.s120,Il rappelle que la CPE a demandé à un groupe de travail de reconsidérer la répartition proposée des NBI à partir des fiches de postes des personnels IATOS .,lui rappeler que le CPE avoir demander à un groupe de travail de reconsidérer le répartition proposer de+le NBI à partir de+le fiche de poste de+le personnel IATOS .,A
61,frau-upn_2010040_PV_CA_2005-09-19_TEI.s121,Mme CELESTE invite les membres du Conseil d' Administration à procéder au vote .,Monsieur Celeste inviter le membre de+le conseil de administration à procéder à+le vote .,A
62,frau-upn_2010040_PV_CA_2005-09-19_TEI.s122,Le Conseil d' Administration adopte à la majorité des membres présents ou représentés la liste des fonctions susceptibles de bénéficier d' une NBI ( cf. annexe 3 ) .,le conseil de administration adopter à le majorité de+le membre présent ou représenter le liste de+le fonction susceptible de bénéficier de un NBI ( cf annexe 3 ) .,A
62,frau-upn_2010040_PV_CA_2005-09-19_TEI.s123,Pour ; 25 ;,pour ; 25 ;,A
62,frau-upn_2010040_PV_CA_2005-09-19_TEI.s124,Contre : 3 ;,contre : 3 ;,A
62,frau-upn_2010040_PV_CA_2005-09-19_TEI.s125,Refus de vote : 1,refus de vote : 1,A
63,frau-upn_2010040_PV_CA_2005-09-19_TEI.s127,M. AUDEOUD explique que l' université est déficitaire en postes IATOS ( d' environ 120 postes ) .,Monsieur AUDEOUD expliquer que le université être déficitaire en poste IATOS ( de environ 120 poste ) .,A
63,frau-upn_2010040_PV_CA_2005-09-19_TEI.s128,Un point a été fait sur les demandes récurrentes non satisfaites .,un point avoir être faire sur le demande récurrent non satisfaire .,A
63,frau-upn_2010040_PV_CA_2005-09-19_TEI.s129,La liste des demandes a été soumise à la CPE .,le liste de+le demande avoir être soumettre à le CPE .,A
63,frau-upn_2010040_PV_CA_2005-09-19_TEI.s130,La priorité est la recherche avec une mutualisation des réponses .,le priorité être le recherche avec un mutualisation de+le réponse .,A
63,frau-upn_2010040_PV_CA_2005-09-19_TEI.s131,Cette liste correspond aux priorités des besoins en personnels administratifs de l' établissement .,ce liste correspondre à+le priorité de+le besoin en personnel administratif de le établissement .,A
64,frau-upn_2010040_PV_CA_2005-09-19_TEI.s132,Mme HANEN demande selon quelles modalités sera mutualisé le Centre de calcul .,Monsieur HANEN demander selon quel modalité être mutualiser le centre de calcul .,A
65,frau-upn_2010040_PV_CA_2005-09-19_TEI.s133,Mme LE PELLEC déclare qu' il serait concevable d' avoir une personne IGE travaillant sur deux laboratoires dans le cadre d' une mutualisation pour la recherche .,Monsieur le PELLEC déclarer que il_expl être concevable de avoir un personne Ige travailler sur deux laboratoire dans le cadre de un mutualisation pour le recherche .,A
