Tour,Id_phrase,phrase,lemmes,accord
156,weban-upn_PV_CA_2008-06-23_TEI.s387,L' Université ne doit rien faire qui puisse gêner la mairie dans la gestion compliquée de ce dossier .,le université ne devoir rien faire qui pouvoir gêner le mairie dans le gestion compliqué de ce dossier .,A
157,weban-upn_PV_CA_2008-06-23_TEI.s388,"Monsieur ELGHOZI explique que le front national , confronté à des difficultés financières , vend son immeuble de Saint-Cloud et cherche à s' installer ailleurs en région parisienne .","Monsieur ELGHOZI expliquer que le front national , confronter à un difficulté financier , vendre son immeuble de Saint-cloud et chercher à soi installer ailleurs en région parisien .",A
157,weban-upn_PV_CA_2008-06-23_TEI.s389,Les termes de la motion reflètent bien le ressentiment de la municipalité en termes d' opposition politique et d' insultes à la mémoire de Nanterre .,le terme de le motion refléter bien le ressentiment de le municipalité en terme de opposition politique et de insulte à le mémoire de Nanterre .,A
157,weban-upn_PV_CA_2008-06-23_TEI.s390,La ville a pris position très clairement mais le représentant de la ville insiste sur le fait que quasiment aucun moyen d' action n' est envisageable .,le ville avoir prendre position très clairement mais le représentant de le ville insister sur le fait que quasiment aucun moyen de action ne être envisageable .,A
157,weban-upn_PV_CA_2008-06-23_TEI.s391,Demain 24 juin 2008 aura lieu un conseil municipal au cours duquel un vœu sera exprimé .,demain 24 juin 2008 avoir lieu un conseil municipal à+le cours de+lequel un vœu être exprimer .,A
157,weban-upn_PV_CA_2008-06-23_TEI.s392,Le Maire est déjà entré en contact avec le propriétaire pour essayer de le dissuader de louer .,le maire être déjà entrer en contact avec le propriétaire pour essayer de lui dissuader de louer .,A
157,weban-upn_PV_CA_2008-06-23_TEI.s393,"La position prise par le CA ne peut pas gêner la municipalité , bien au contraire .","le position prendre par le CA ne pouvoir pas gêner le municipalité , bien à+le contraire .",A
158,weban-upn_PV_CA_2008-06-23_TEI.s394,Mademoiselle FAVARO estime important que l' Université exprime son inquiétude quant à l' implantation du siège du front national aussi près de l' Université .,Mademoiselle FAVARO estimer important que le université exprimer son inquiétude quant à le implantation de+le siège de+le front national aussi près de le université .,A
158,weban-upn_PV_CA_2008-06-23_TEI.s395,Cela pourrait faire craindre l' arrivée de groupes de militants sur l' Université .,cela pouvoir faire craindre le arrivée de groupe de militant sur le université .,A
158,weban-upn_PV_CA_2008-06-23_TEI.s396,Il manquerait dans la motion ce lien de cause à effet .,lui manquer dans le motion ce lien de cause à effet .,A
159,weban-upn_PV_CA_2008-06-23_TEI.s397,Madame MADEUF déclare que la motion doit être complétée .,Monsieur MADEUF déclarer que le motion devoir être compléter .,A
159,weban-upn_PV_CA_2008-06-23_TEI.s398,Elle s' interroge aussi sur la portée de cette motion .,lui se_expl interroger aussi sur le portée de ce motion .,A
159,weban-upn_PV_CA_2008-06-23_TEI.s399,Elle demande si cela peut aider la mairie que l' Université ait une prise de position .,lui demander si cela pouvoir aider le mairie que le université avoir un prise de position .,A
160,weban-upn_PV_CA_2008-06-23_TEI.s400,Monsieur ELGHOZI répond que oui .,Monsieur ELGHOZI répondre que oui .,A
160,weban-upn_PV_CA_2008-06-23_TEI.s401,"Cependant , il insiste de nouveau sur le manque de moyens d' action juridique .","cependant , lui insister de nouveau sur le manque de moyen de action juridique .",A
160,weban-upn_PV_CA_2008-06-23_TEI.s402,Le préfet a été saisi au motif de risque de trouble à l' ordre public .,le préfet avoir être saisir à+le motif de risque de trouble à le ordre public .,A
161,weban-upn_PV_CA_2008-06-23_TEI.s403,Madame MADEUF déclare que ce texte peut de toute façon avoir une portée symbolique .,Monsieur MADEUF déclarer que ce texte pouvoir de tout façon avoir un portée symbolique .,A
162,weban-upn_PV_CA_2008-06-23_TEI.s404,Mademoiselle BENHEBRI ajoute que du point de vue de son organisation le but est de demander une prise de position au CA de Nanterre et en aucun cas de plaire à la Mairie qui pour l' instant ne les a pas soutenus autant qu' ils le souhaiteraient .,Mademoiselle BENHEBRI ajouter que de+le point de vue de son organisation le but être de demander un prise de position à+le CA de Nanterre et en aucun cas de plaire à le mairie qui pour le instant ne eux avoir pas soutenir autant que eux lui souhaiter .,A
163,weban-upn_PV_CA_2008-06-23_TEI.s405,Madame COQUELET se tient à leur disposition pour rédiger la motion .,Monsieur COQUELET se_expl tenir à son disposition pour rédiger le motion .,A
164,weban-upn_PV_CA_2008-06-23_TEI.s407,Madame MADEUF donne lecture de la motion :,Monsieur MADEUF donner lecture de le motion :,A
165,weban-upn_PV_CA_2008-06-23_TEI.s408,"« Opération campus : 6 projets retenus , 40 laissés pour compte","« opération campus : 6 projet retenir , 40 laisser pour compte",A
165,weban-upn_PV_CA_2008-06-23_TEI.s409,"Le conseil d' administration de l' université de Nanterre , réuni le 23 juin 2008 tient à exprimer des inquiétudes quant à l' application de l' opération campus .","le conseil de administration de le université de Nanterre , réunir le 23 juin 2008 tenir à exprimer un inquiétude quant à le application de le opération campus .",A
165,weban-upn_PV_CA_2008-06-23_TEI.s410,"En effet , si elle permet de prendre enfin en compte la situation dégradée du patrimoine universitaire français , l' opération campus , en ne prévoyant de ne financer que 10 projets , risque de creuser les écarts entre les universités , et notamment celles implantées sur des villes de taille moyenne dont aucune n' a bénéficié des 6 premiers projets retenus .","en effet , si lui permettre de prendre enfin en compte le situation dégrader de+le patrimoine universitaire français , le opération campus , en ne prévoir de ne financer que 10 projet , risquer de creuser le écart entre le université , et notamment celui implanter sur un ville de taille moyen dont aucun ne avoir bénéficier de+le 6 premier projet retenir .",A
165,weban-upn_PV_CA_2008-06-23_TEI.s411,"Pourtant , loin de 10 campus vitrines , c' est bien l' ensemble des universités qui ont besoin d' un investissement conséquent pour améliorer leurs bâtiments .","pourtant , loin de 10 campus vitrine , ce être bien le ensemble de+le université qui avoir besoin de un investissement conséquent pour améliorer son bâtiment .",A
165,weban-upn_PV_CA_2008-06-23_TEI.s412,"En effet , l' ensemble du patrimoine universitaire est dégradé : selon l' observatoire de la sécurité des établissements scolaires et de l' enseignement supérieur , 30 % des bâtiments universitaires sont dégradés ou très dégradés , 15 % des campus sont inadaptés à leur mission , la moitié des campus n' ont connu aucune rénovation depuis 30 ans et 4 % du parc immobilier universitaire est composé de bâtiments démontables .","en effet , le ensemble de+le patrimoine universitaire être dégrader : selon le observatoire de le sécurité de+le établissement scolaire et de le enseignement supérieur , 30 % de+le bâtiment universitaire être dégrader ou très dégradé , 15 % de+le campus être inadapté à son mission , le moitié de+le campus ne avoir connaître aucun rénovation depuis 30 an et 4 % de+le parc immobilier universitaire être composer de bâtiment démontable .",A
165,weban-upn_PV_CA_2008-06-23_TEI.s413,L' université de Nanterre n' a pas été retenue dans l' opération campus .,le université de Nanterre ne avoir pas être retenir dans le opération campus .,A
165,weban-upn_PV_CA_2008-06-23_TEI.s414,"Pourtant , elle ne dispose que de 5 m2 par étudiant , la majorité des bâtiments ( A , B , C , D , E , F , G et l' IUT de Ville d' Avray ) ont reçu un avis défavorable de la commission hygiène et sécurité .","pourtant , lui ne disposer que de 5 m2 par étudiant , le majorité de+le bâtiment ( A , B , C , D , E , F , G et le IUT de Ville de Avray ) avoir recevoir un avis défavorable de le commission hygiène et sécurité .",A
165,weban-upn_PV_CA_2008-06-23_TEI.s415,Le conseil d' administration de l' université de Nanterre demande à ce qu' une enveloppe conséquente soit réservée à tous les projets de rénovation permettant de remettre à niveau l' ensemble des universités françaises .,le conseil de administration de le université de Nanterre demander à ce que un enveloppe conséquent être réserver à tout le projet de rénovation permettre de remettre à niveau le ensemble de+le université français .,A
165,weban-upn_PV_CA_2008-06-23_TEI.s416,»,»,A
166,weban-upn_PV_CA_2008-06-23_TEI.s417,"Madame MADEUF fait remarquer que l' avant-dernier paragraphe est excessif dans la formulation ( « la majorité des bâtiments ( A , B , C , D , E , F , G et l' IUT de Ville d' Avray ) ont reçu un avis défavorable de la commission hygiène et sécurité » ) .","Monsieur MADEUF faire remarquer que le avant-dernier paragraphe être excessif dans le formulation ( « le majorité de+le bâtiment ( A , B , C , D , E , F , G et le IUT de ville de Avray ) avoir recevoir un avis défavorable de le commission hygiène et sécurité » ) .",A
167,weban-upn_PV_CA_2008-06-23_TEI.s418,Mademoiselle FAVARO répond que ce sont les informations données par M. GUINOT .,Mademoiselle FAVARO répondre que ce être le information donner par Monsieur GUINOT .,A
168,weban-upn_PV_CA_2008-06-23_TEI.s419,Madame MADEUF explique que le paragraphe est à reformuler .,Monsieur MADEUF expliquer que le paragraphe être à reformuler .,A
168,weban-upn_PV_CA_2008-06-23_TEI.s420,"Des bâtiments ont été mis aux normes de sécurité et n' ont donc pas reçu d' avis défavorable de la commission , et d' autres vont l' être prochainement .","un bâtiment avoir être mettre à+le norme de sécurité et ne avoir donc pas recevoir un avis défavorable de le commission , et un autre aller lui être prochainement .",A
169,weban-upn_PV_CA_2008-06-23_TEI.s421,Madame ESTELLE pointe une contradiction entre le premier paragraphe et le fait que pour certains bâtiments on ait un avis défavorable de la commission .,Monsieur Estelle pointer un contradiction entre le premier paragraphe et le fait que pour certain bâtiment on avoir un avis défavorable de le commission .,A
169,weban-upn_PV_CA_2008-06-23_TEI.s422,On ne peut pas dire que le plan prend en compte la situation dégradée de l' ensemble du patrimoine .,on ne pouvoir pas dire que le plan prendre en compte le situation dégrader de le ensemble de+le patrimoine .,A
170,weban-upn_PV_CA_2008-06-23_TEI.s423,Monsieur VOILLIOT propose un amendement sur la première phrase de la motion : « s' inquiètent de la logique inégalitaire que sous-tend l' opération campus » .,Monsieur VOILLIOT proposer un amendement sur le premier phrase de le motion : « se_expl inquiéter de le logique inégalitaire que sous-tendre le opération campus » .,A
171,weban-upn_PV_CA_2008-06-23_TEI.s424,Mademoiselle FAVARO exprime son accord avec M. VOILLIOT .,Mademoiselle FAVARO exprimer son accord avec Monsieur VOILLIOT .,A
171,weban-upn_PV_CA_2008-06-23_TEI.s425,Elle répond à Madame ESTELLE que le but affiché par l' opération est de reconnaître qu' il y a des bâtiments dégradés et qu' une solution va y être apportée .,lui répondre à Monsieur Estelle que le but afficher par le opération être de reconnaître que il_expl y avoir un bâtiment dégradé et que un solution aller y être apporter .,A
171,weban-upn_PV_CA_2008-06-23_TEI.s426,"Même si les solutions apportées peuvent être jugées partielles et peu suffisantes , il y a tout de même eu la reconnaissance du problème de l' état des locaux dans les universités .","même si le solution apporter pouvoir être juger partiel et peu suffisant , il_expl y avoir tout de même avoir le reconnaissance de+le problème de le état de+le local dans le université .",A
172,weban-upn_PV_CA_2008-06-23_TEI.s427,Madame ESTELLE répond que la dégradation était déjà reconnue dans les plans précédents .,Monsieur Estelle répondre que le dégradation être déjà reconnaître dans le plan précédent .,A
172,weban-upn_PV_CA_2008-06-23_TEI.s428,"Elle propose de supprimer « En effet , si elle permet de prendre enfin en compte la situation dégradée du patrimoine universitaire français » .","lui proposer de supprimer « en effet , si lui permettre de prendre enfin en compte le situation dégrader de+le patrimoine universitaire français » .",A
173,weban-upn_PV_CA_2008-06-23_TEI.s429,Mademoiselle FAVARO exprime son accord .,Mademoiselle FAVARO exprimer son accord .,A
173,weban-upn_PV_CA_2008-06-23_TEI.s430,"En réponse à Madame MADEUF , elle explique avoir appelé M. GUINOT pour obtenir des informations concernant les bâtiments n' ayant pas reçu d' avis favorable de la commission Hygiène et sécurité .","en réponse à Monsieur MADEUF , lui expliquer avoir appeler Monsieur GUINOT pour obtenir un information concernant le bâtiment ne avoir pas recevoir un avis favorable de le commission hygiène et sécurité .",A
173,weban-upn_PV_CA_2008-06-23_TEI.s431,Les bâtiments cités dans la motion sont ceux indiqués par M. GUINOT .,le bâtiment citer dans le motion être celui indiquer par Monsieur GUINOT .,A
174,weban-upn_PV_CA_2008-06-23_TEI.s432,"Madame MADEUF explique qu' il y a eu des levées partielles , notamment sur les bâtiments F et G.","Monsieur MADEUF expliquer que il_expl y avoir avoir un levée partiel , notamment sur le bâtiment F et G.",A
175,weban-upn_PV_CA_2008-06-23_TEI.s433,"Monsieur PUICHAUD-CHAUDOT précise que certains bâtiments n' ont pas encore reçu d' avis favorable de la commission , simplement parce que le processus n' est pas encore terminé .","Monsieur PUICHAUD-CHAUDOT préciser que certain bâtiment ne avoir pas encore recevoir un avis favorable de le commission , simplement parce que le processus ne être pas encore terminer .",A
175,weban-upn_PV_CA_2008-06-23_TEI.s434,Néanmoins l' Université est loin de la situation de départ .,néanmoins le université être loin de le situation de départ .,A
175,weban-upn_PV_CA_2008-06-23_TEI.s435,"De plus , en termes de communication vers l' extérieur il serait préjudiciable à l' Université de rédiger le problème de cette façon .","de plus , en terme de communication vers le extérieur lui être préjudiciable à le université de rédiger le problème de ce façon .",A
176,weban-upn_PV_CA_2008-06-23_TEI.s436,Madame LE PELLEC ajoute qu' il y a une différence entre les agréments hygiène et sécurité et les nécessités de mise aux normes des bâtiments en termes d' enseignement du XXI ème siècle .,Monsieur le PELLEC ajouter que il_expl y avoir un différence entre le agrément hygiène et sécurité et le nécessité de mise à+le norme de+le bâtiment en terme de enseignement de+le XXI ème siècle .,A
176,weban-upn_PV_CA_2008-06-23_TEI.s437,Elle rappelle que deux tranches de financement ont eu lieu à l' IUT de Ville d' Avray .,lui rappeler que deux tranche de financement avoir avoir lieu à le IUT de ville de Avray .,A
177,weban-upn_PV_CA_2008-06-23_TEI.s438,Mademoiselle FAVARO propose de retirer la liste des bâtiments de la motion .,Mademoiselle FAVARO proposer de retirer le liste de+le bâtiment de le motion .,A
178,weban-upn_PV_CA_2008-06-23_TEI.s439,Madame MADEUF fait procéder au vote sur la motion modifiée ci-dessous :,Monsieur MADEUF faire procéder à+le vote sur le motion modifier ci-dessous :,A
179,weban-upn_PV_CA_2008-06-23_TEI.s440,"« Opération campus : 6 projets retenus , 40 laissés pour compte","« opération campus : 6 projet retenir , 40 laisser pour compte",A
10,frau-upn_2010040-04_CR_CA_1991-09-23_TEI.s76,Le SGEN s' élève contre la politique du fait accompli suivie depuis de longs mois par les promoteurs du projet .,le SGEN se_expl élever contre le politique de+le fait accompli suivre depuis un long mois par le promoteur de+le projet .,D
54,weban-upn_PV_CA_2008-06-23_TEI.s137,En termes d' ouverture elle trouve cela dommage .,en terme de ouverture lui trouver cela dommage .,D
55,weban-upn_PV_CA_2008-06-23_TEI.s138,Madame MADEUF trouve dommage que la demande d' ouverture honorable qui arrive maintenant ne se soit pas manifestée plus tôt lors des tours d' élection présidentielle .,Monsieur MADEUF trouver dommage que le demande de ouverture honorable qui arriver maintenant ne se_expl être pas manifester plus tôt lors de+le tour de élection présidentiel .,D
73,weban-upn_PV_CA_2008-06-23_TEI.s182,Il estime cette base de négociation assez fermée .,lui estimer ce base de négociation assez fermer .,D
34,frau-upn_2010040_PV_CA_2004-03-22_TEI.s165,L' UNEF appelle à voter contre ces propositions et souhaite une suspension de séance .,le UNEF appeler à voter contre ce proposition et souhaiter un suspension de séance .,D
39,frau-upn_2010040_PV_CA_2004-03-22_TEI.s190,Mlle MARY indique que Cultur'PX votera contre la proposition ;,Mlle Mary indiquer que Cultur'PX voter contre le proposition ;,D
41,frau-upn_2010040_PV_CA_2004-03-22_TEI.s198,L' UNEF votera contre cette proposition du fait du déficit démocratique .,le UNEF voter contre ce proposition de+le fait de+le déficit démocratique .,D
56,frau-upn_2010040_PV_CA_2004-03-22_TEI.s247,L' UNEF appelle à voter contre la liste de diplômes proposée .,le UNEF appeler à voter contre le liste de diplôme proposer .,D
65,frau-upn_2010040_PV_CA_2004-03-22_TEI.s288,Il estime absurde d' évaluer en termes d' heures le travail personnel des étudiants .,lui estimer absurde de évaluer en terme de heure le travail personnel de+le étudiant .,D
68,frau-upn_2010040_PV_CA_2004-03-22_TEI.s316,M. LEGRAND se dit surpris des remarques faites à propos du DEUG : les arrêtés de 1997 ne sont pas abrogés ;,Monsieur LEGRAND se_expl dire surprendre un remarque faire à propos de+le DEUG : le arrêté de 1997 ne être pas abroger ;,D
78,frau-upn_2010040_PV_CA_2004-03-22_TEI.s398,Il n' estime pas judicieux de segmenter ces réflexions qui sont intimement liées .,lui ne estimer pas judicieux de segmenter ce réflexion qui être intimement lier .,D
112,frau-upn_2010040_PV_CA_2004-03-22_TEI.s510,"M. CHIARELLI juge très discriminatoire la procédure d' admission préalable : les ressortissants étrangers hors Union européenne , doivent avant même d' avoir passé le baccalauréat , effectuer des démarches consistant à demander des dossiers auprès de 2 universités ;","Monsieur CHIARELLI juger très discriminatoire le procédure de admission préalable : le ressortissant étranger hors union européen , devoir avant même de avoir passer le baccalauréat , effectuer un démarche consister à demander un dossier auprès de 2 université ;",D
147,frau-upn_2010040_PV_CA_2004-03-22_TEI.s661,M. GAY estime qu' il n' est pas normal d' évoquer cette question en CA alors qu' on ne dispose pas de toutes les informations concernant ces incidents .,Monsieur Gay estimer que il_expl ne être pas normal de évoquer ce question en CA alors que on ne disposer pas de tout le information concernant ce incident .,D
2,frau-upn_2010040-04_CR_CA_1991-02-04_TEI.s17,"Monsieur le Président , le courrier que j' ai reçu ce matin m' a totalement surpris .","Monsieur le président , le courrier que moi avoir recevoir ce matin moi avoir totalement surprendre .",D
37,frau-upn_2010040-04_CR_CA_1991-02-04_TEI.s134,"Monsieur G. ESNAULT estime intéressant le projet de capitalisation des modules , mais souhaiterait qu' un tronc commun plus large soit prévu pour les étudiants de 1ère année .Par ailleurs , il serait hostile à la suppression de la session de rattrapage de septembre .","Monsieur G. ESNAULT estimer intéressant le projet de capitalisation de+le module , mais souhaiter que un tronc commun plus large être prévoir pour le étudiant de 1ère année .par ailleurs , lui être hostile à le suppression de le session de rattrapage de septembre .",D
39,frau-upn_2010040-04_CR_CA_1991-02-04_TEI.s138,il est hostile à la semestrialisation qui ne semble pas opportune .,lui être hostile à le semestrialisation qui ne sembler pas opportun .,D
31,frau-upn_2010040-04_CR_CA_1995-10-26_TEI.s120,Il estime insuffisante l' aide du Conseil Général et rappelle encore une fois que c' est l' Etat notre premier interlocuteur .,lui estimer insuffisant le aide de+le conseil général et rappeler encore un fois que ce être le état son premier interlocuteur .,D
127,weban-upn_PV_CA_2017-09-25_TEI.s462,M. GIOT-MIKKELSEN se dit surpris d' apprendre que la Fondation n' avait pas vocation à abonder au budget de l' Université .,Monsieur GIOT-MIKKELSEN se_expl dire surprendre de apprendre que le fondation ne avoir pas vocation à abonder à+le budget de le université .,D
132,weban-upn_PV_CA_2017-09-25_TEI.s490,il met en garde sur le fait de remettre en cause ce projet .,lui mettre en garde sur le fait de remettre en cause ce projet .,D
162,weban-upn_PV_CA_2017-09-25_TEI.s584,"Comme elle l' avait déjà souligné l' an dernier , Mme ROBERT trouve regrettable une telle évolution à l' Université de Nanterre ;","comme lui lui avoir déjà souligner le an dernier , Monsieur Robert trouver regrettable un tel évolution à le université de Nanterre ;",D
7,fradhds-upn_2283W_CR_CA_1988-03-07_TEI.s34,"M. SADOCK se déclare inquiet par la montée de la tension au sein de l' Université ( panneaux mobiles de l' AGEN - UNEF saccagés en Droit , provocations diverses etc... ) .","Monsieur SADOCK se_expl déclarer inquiet par le montée de le tension à+le sein de le université ( panneau mobile de le Agen - UNEF saccager en droit , provocation divers etc... ) .",D
15,fradhds-upn_2283W_CR_CA_1988-03-07_TEI.s82,Monsieur le Président tient à protester contre l' omission dans cette liste de la licence de Sciences de l' Education .,Monsieur le président tenir à protester contre le omission dans ce liste de le licence de Sciences de le Education .,D
6,fradhds-upn_2283W_CR_CA_1985-11-04_TEI.s20,M. VIGIER est choqué par la réaction de M. DARRIULAT .,Monsieur VIGIER être choquer par le réaction de Monsieur DARRIULAT .,D
22,frau-upn_2008002-10_CR_CA_2002-03-18_TEI.s60,M. DESMELIERS estime ces tarifs exorbitants ;,Monsieur DESMELIERS estimer ce tarif exorbitant ;,D
23,frau-upn_2008002-10_CR_CA_2002-03-18_TEI.s64,L' UNEF votera contre ces tarifications qui induisent des charges très lourdes pour les stagiaires .,le UNEF voter contre ce tarification qui induire un charge très lourd pour le stagiaire .,D
43,frau-upn_2008002-10_CR_CA_2002-03-18_TEI.s176,Il fait part de son désaccord concernant l' existence d' une note éliminatoire .,lui faire part de son désaccord concernant le existence de un note éliminatoire .,D
50,frau-upn_2008002-10_CR_CA_2002-03-18_TEI.s216,M. DESMELIERS juge exorbitants les tarifs demandés pour l' inscription des stagiaires à cette formation ;,Monsieur DESMELIERS juger exorbitant le tarif demander pour le inscription de+le stagiaire à ce formation ;,D
31,frau-upn_2010040-06_PV_CA_2000-02-21_TEI.s85,M. DESMELIERS indique que l' UNEF - ID votera contre cette disposition .,Monsieur DESMELIERS indiquer que le UNEF - ID voter contre ce disposition .,D
32,frau-upn_2010040-06_PV_CA_2000-02-21_TEI.s86,"M , CORNACCHIA estime peu judicieux de mesurer la motivation des étudiants sur des critères financiers .","M , CORNACCHIA estimer peu judicieux de mesurer le motivation de+le étudiant sur un critère financier .",D
34,frau-upn_2010040-06_PV_CA_2000-02-21_TEI.s88,"M. BRAVAIS estimant que les étudiants partant étudier à l' étranger peuvent se trouver en situation financièrement précaire , annonce qu' il votera contre la participation de 500 F","Monsieur BRAVAIS estimer que le étudiant partir étudier à le étranger pouvoir se_expl trouver en situation financièrement précaire , annoncer que lui voter contre le participation de 500 F",D
62,frau-upn_2010040-06_PV_CA_2000-02-21_TEI.s160,"M. LEGRAND considère que cette comparaison n' est pas judicieuse , le militantisme étudiant étant de courte durée .","Monsieur LEGRAND considérer que ce comparaison ne être pas judicieux , le militantisme étudiant être de court durée .",D
69,frau-upn_2010040-06_PV_CA_2000-02-21_TEI.s177,"M. MARTINEAU estime trop tardive , la date de réponse de l' université aux bacheliers de province sollicitant une inscription ( 15 octobre ) compte tenu des implications matérielles ( déménagement ... ) .","Monsieur MARTINEAU estimer trop tardif , le date de réponse de le université à+le bachelier de province solliciter un inscription ( 15 octobre ) compte tenir un implication matériel ( déménagement ... ) .",D
7,frau-upn_2010040_PV_CA_2004-02-16_TEI.s29,Il se dit très choqué de constater que ce dossier n' a fait l' objet d' aucune gestion véritable .,lui se_expl dire très choquer de constater que ce dossier ne avoir faire le objet de aucun gestion véritable .,D
12,frau-upn_2010040_PV_CA_2004-02-16_TEI.s52,Mme RIOUX se dit surprise que cette disposition provoque un étonnement ;,Monsieur Rioux se_expl dire surprise que ce disposition provoquer un étonnement ;,D
19,frau-upn_2010040_PV_CA_2004-02-16_TEI.s85,"Elle se dit choquée de constater que les personnes invitées ne respectent pas les règles démocratiques : les élus portent la responsabilité entière de ce qu' ils font , eux seuls peuvent prendre part au débat .","lui se_expl dire choquer de constater que le personne inviter ne respecter pas le règle démocratique : le élu porter le responsabilité entier de ce que eux faire , eux seul pouvoir prendre part à+le débat .",D
